{
  "/home/ubuntu/cloud-project-final/backend/api-usuarios/serverless.yml": {
    "versionFramework": "4.17.1",
    "servicePath": "/home/ubuntu/cloud-project-final/backend/api-usuarios/serverless.yml",
    "serviceConfigFileName": "serverless.yml",
    "service": {
      "org": "elicervantess",
      "service": "api-usuarios",
      "provider": {
        "name": "aws",
        "runtime": "python3.12",
        "region": "us-east-1",
        "role": "arn:aws:iam::633777173661:role/LabRole",
        "environment": {
          "PYTHONPATH": "src/",
          "JWT_SECRET": "<REDACTED>",
          "TOKEN_EXPIRY": "<REDACTED>"
        },
        "stage": "dev",
        "versionFunctions": true
      },
      "plugins": [
        "serverless-dotenv-plugin",
        "serverless-python-requirements"
      ],
      "custom": {
        "pythonRequirements": {
          "dockerizePip": true,
          "fileName": "requirements.txt"
        }
      },
      "functions": {
        "create_user": {
          "handler": "src.create_user.lambda_handler",
          "events": [
            {
              "http": {
                "path": "users/register",
                "method": "post",
                "cors": true
              }
            }
          ],
          "name": "api-usuarios-dev-create_user"
        },
        "login_user": {
          "handler": "src.login_user.lambda_handler",
          "events": [
            {
              "http": {
                "path": "users/login",
                "method": "post",
                "cors": true
              }
            }
          ],
          "name": "api-usuarios-dev-login_user"
        },
        "validate_token": "<REDACTED>"
      },
      "resources": {
        "Resources": {
          "UsersTable": {
            "Type": "AWS::DynamoDB::Table",
            "Properties": {
              "TableName": "dev-t-users",
              "AttributeDefinitions": [
                {
                  "AttributeName": "tenant_id",
                  "AttributeType": "S"
                },
                {
                  "AttributeName": "user_id",
                  "AttributeType": "S"
                },
                {
                  "AttributeName": "email",
                  "AttributeType": "S"
                }
              ],
              "KeySchema": [
                {
                  "AttributeName": "tenant_id",
                  "KeyType": "HASH"
                },
                {
                  "AttributeName": "user_id",
                  "KeyType": "RANGE"
                }
              ],
              "BillingMode": "PAY_PER_REQUEST",
              "GlobalSecondaryIndexes": [
                {
                  "IndexName": "EmailIndex",
                  "KeySchema": [
                    {
                      "AttributeName": "email",
                      "KeyType": "HASH"
                    }
                  ],
                  "Projection": {
                    "ProjectionType": "ALL"
                  }
                }
              ]
            }
          }
        }
      },
      "package": {
        "exclude": [
          "__pycache__/**",
          "venv/**"
        ],
        "artifactsS3KeyDirname": "serverless/api-usuarios/dev/code-artifacts"
      }
    },
    "provider": {
      "name": "aws",
      "runtime": "python3.12",
      "region": "us-east-1",
      "role": "arn:aws:iam::633777173661:role/LabRole",
      "environment": {
        "PYTHONPATH": "src/",
        "JWT_SECRET": "<REDACTED>",
        "TOKEN_EXPIRY": "<REDACTED>"
      },
      "stage": "dev",
      "versionFunctions": true
    },
    "dashboard": {
      "isEnabledForService": false,
      "requiredAuthentication": false,
      "orgFeaturesInUse": null,
      "orgObservabilityIntegrations": null,
      "serviceAppId": null,
      "serviceProvider": null,
      "instanceParameters": null
    },
    "error": {
      "message": "User: arn:aws:sts::633777173661:assumed-role/voclabs/user3581639=Cervantes_Ordo__ez,_Jireh_Eliseo_ is not authorized to perform: cloudformation:DescribeStackResource on resource: arn:aws:cloudformation:us-east-1:633777173661:stack/api-usuarios-dev/a5818e00-5b39-11f0-af5b-0afff8159469 with an explicit deny in an identity-based policy",
      "stack": "ServerlessError2: User: arn:aws:sts::633777173661:assumed-role/voclabs/user3581639=Cervantes_Ordo__ez,_Jireh_Eliseo_ is not authorized to perform: cloudformation:DescribeStackResource on resource: arn:aws:cloudformation:us-east-1:633777173661:stack/api-usuarios-dev/a5818e00-5b39-11f0-af5b-0afff8159469 with an explicit deny in an identity-based policy\n    at file:///home/ubuntu/.serverless/releases/4.17.1/package/dist/sf-core.js:1155:36\n    at process.processTicksAndRejections (node:internal/process/task_queues:95:5)\n    at async persistentRequest (file:///home/ubuntu/.serverless/releases/4.17.1/package/dist/sf-core.js:1154:1960)",
      "code": "AWS_CLOUD_FORMATION_DESCRIBE_STACK_RESOURCE_ACCESS_DENIED"
    },
    "serviceRawFile": "org: elicervantess\nservice: api-usuarios\n\nprovider:\n  name: aws\n  runtime: python3.12\n  region: us-east-1\n  role: arn:aws:iam::633777173661:role/LabRole\n  environment:\n    PYTHONPATH: src/\n    JWT_SECRET: ${env:JWT_SECRET}\n    TOKEN_EXPIRY: ${env:TOKEN_EXPIRY}\n\nplugins:\n  - serverless-dotenv-plugin\n  - serverless-python-requirements\n\ncustom:\n  pythonRequirements:\n    dockerizePip: true\n    fileName: requirements.txt\n\nfunctions:\n  create_user:\n    handler: src.create_user.lambda_handler\n    events:\n      - http:\n          path: users/register\n          method: post\n          cors: true\n\n  login_user:\n    handler: src.login_user.lambda_handler\n    events:\n      - http:\n          path: users/login\n          method: post\n          cors: true\n\n  validate_token:\n    handler: src.validate_token.lambda_handler\n    events:\n      - http:\n          path: users/validate-token\n          method: post\n          cors: true\n\nresources:\n  Resources:\n    UsersTable:\n      Type: \"AWS::DynamoDB::Table\"\n      Properties:\n        TableName: ${sls:stage}-t-users\n        AttributeDefinitions:\n          - AttributeName: \"tenant_id\"\n            AttributeType: \"S\"\n          - AttributeName: \"user_id\"\n            AttributeType: \"S\"\n          - AttributeName: \"email\"\n            AttributeType: \"S\"\n        KeySchema:\n          - AttributeName: \"tenant_id\"\n            KeyType: \"HASH\"\n          - AttributeName: \"user_id\"\n            KeyType: \"RANGE\"\n        BillingMode: PAY_PER_REQUEST\n        GlobalSecondaryIndexes:\n          - IndexName: EmailIndex\n            KeySchema:\n              - AttributeName: \"email\"\n                KeyType: \"HASH\"\n            Projection:\n              ProjectionType: ALL\n\npackage:\n  exclude:\n    - __pycache__/**\n    - venv/**\n",
    "command": [
      "deploy"
    ],
    "options": {
      "stage": "dev",
      "force": true
    },
    "orgId": "012d43c0-04e9-4842-acde-976bbda22361",
    "orgName": "elicervantess",
    "userId": "DZWtBNtphGy2dfGHHF",
    "userName": "elicervantess",
    "serviceProviderAwsAccountId": "633777173661",
    "serviceProviderAwsCfStackId": null,
    "serviceProviderAwsCfStackCreated": null,
    "serviceProviderAwsCfStackUpdated": null,
    "serviceProviderAwsCfStackStatus": null,
    "serviceProviderAwsCfStackOutputs": null
  }
}